{
  "offenceDefinitionId": "62bbc890-1e3e-4b98-b2fe-107d07f75259",
  "offenceCode": "AAA",
  "offenceTitle": "Drunkenness in a public place",
  "offenceTitleWelsh": "Meddwdod mewn man cyhoeddus",
  "offenceLegislation": "Criminal Justice Act 1967",
  "offenceLegislationWelsh": "Deddf Cyfiawnder Troseddol 1967"
}
